<!ELEMENT catalog    (book+) >
<!ELEMENT book       (author, title, genre, price, publish_date, description) >
<!ATTLIST book       id ID #REQUIRED >
<!ELEMENT author         (#PCDATA)   >
<!ELEMENT title          (#PCDATA)   >
<!ELEMENT genre          (#PCDATA)   >
<!ELEMENT price          (#PCDATA)   >
<!ELEMENT publish_date   (#PCDATA)   >
<!ELEMENT description    (#PCDATA)   >